en|fr
rm f /etc/default/tftpd hpa to remove no longer needed modifications rm rf /var/lib/tftpboot to remove no longer used tftp base directory dpkg reconfigure p low tftpd hpa first prompt: keep tftp as system account, second: change TFTP root directory to /srv/tftp third: keep address and port, last one: enter secure as additional option service tftpd hpa restart rm rf /opt/ltsp cleanup old LTSP base directory The next steps will need quite some execution time. debian edu ltsp install arch amd64 diskless_workstation no thin_type bare if 64 Bit thin client support is wanted debian edu ltsp install arch i386 diskless_workstation no thin_type bare if 32 Bit thin client support is wanted debian edu ltsp install diskless_workstation yes to create diskless workstation image from the servers file system debian edu pxeinstall to add PXE installation files and related iPXE menu items|rm f /etc/default/tftpd hpa pour supprimer les modifications plus nécessaires rm rf /var/lib/tftpboot pour supprimer le répertoire de base TFTP plus utilisé dpkg reconfigure p low tftpd hpa première invite garder tftp comme compte système, deuxième changer le répertoire racine de TFTP pour /srv/tftp, troisième garder ladresse et le port, dernière invite entrer secure comme option supplémentaire service tftpd hpa restart rm rf /opt/ltsp nettoyer lancien répertoire de base de LTSP Les étapes suivantes auront besoin dun peu de temps dexécution. debian edu ltsp install arch amd64 diskless_workstation no thin_type bare si la prise en charge dun client léger 64 bits est recherchée debian edu ltsp install arch i386 diskless_workstation no thin_type bare si la prise en charge dun client léger 32 bits est recherchée debian edu ltsp install diskless_workstation yes pour créer limage de station de travail sans disque à partir du système de fichiers du serveur debian edu pxeinstall pour ajouter les fichiers dinstallation PXE et les entrées de menu iPXE liées
Cope with move to iPXE:|Gérer le passage à iPXE
Create a file ipxe.ldif with the following content:|Créer un fichier ipxe.ldif avec le contenu suivant
Then run ldapadd ZD cn=admin,ou=ldap access,dc=skole,dc=skolelinux,dc=no W f ipxe.ldif to apply the changes.|Exécutez ensuite ldapadd ZD cn=admin,ou=ldap access,dc=skole,dc=skolelinux,dc=no W f ipxe.ldif pour appliquer les modifications.
Modify some more DHCP settings in LDAP, e.g. using an editor like ldapvi. Make sure, DHCP related entries match those contained in the /etc/ldap/gosa server.ldif file. Entries concerned are:|Modifiez certains paramètres DHCP supplémentaires dans LDAP, par ex. en utilisant un éditeur comme ldapvi. Assurez vous que les entrées liées à DHCP correspondent à celles contenues dans le fichier /etc/ldap/gosa server.ldif. Les inscriptions concernées sont
Cope with GOsa changes use new gosa.conf, fix LDAP access:|Gérer les changements de GOsa utiliser le nouveau fichier gosa.conf, corriger laccès LDAP
cp /etc/gosa/gosa.conf /etc/gosa/gosa.conf.buster backup|cp /etc/gosa/gosa.conf /etc/gosa/gosa.conf.buster sauvegarde
cp /usr/share/debian edu config/gosa.conf.template /etc/gosa/gosa.conf new gosa.conf file|cp /usr/share/debian edu config/gosa.conf.template /etc/gosa/gosa.conf nouveau fichier gosa.conf
Search for adminPassword and snapshotAdminPassword in /etc/gosa/gosa.conf and replace $GOSAPWD with the random password found in /etc/gosa/gosa.conf.orig for those entries.|Rechercher adminPassword et snapshotAdminPassword dans /etc/gosa/gosa.conf et remplacer $GOSAPWD par le mot de passe aléatoire trouvé dans /etc/gosa/gosa.conf.orig pour ces entrées.
Run gosa encrypt passwords|Exécutez gosa encrypt passwords
Run service apache2 restart|Exécutez service apache2 restart.
Cope with Kerberos encryption type changes:|Gérer les changements de type de chiffrement de Kerberos
Run service krb5 kdc restart|Exécutez service krb5 kdc restart.
Cope with Samba changes:|Gérer les modifications de Samba
Add first users Samba account: smbpasswd a <first username>. Once users change their password, the related Samba account will be created.|Ajoutez le compte Samba du premier utilisateur smbpasswd a <first username>. Une fois que les utilisateurs auront modifié leur mot de passe, le compte Samba sera créé.
Check if the upgraded system works:|Vérifier que le système mis à niveau fonctionne
Reboot; log in as first user and test|Redémarrez connectez vous comme premier utilisateur et testez
if the GOsa² gui is working,|si linterface graphique de GOsa² fonctionne,
if one is able to connect LTSP clients and workstations,|sil est possible de se connecter aux clients LTSP et aux stations de travail,
if one can add/remove a netgroup membership of a system,|sil est possible dajouter ou de retirer lappartenance à un groupe réseau dun système,
if one can send and receive internal email,|sil est possible denvoyer et de recevoir des courriels internes,
if one can manage printers,|sil est possible de gérer les imprimantes,
and if other site specific things are working.|et si dautres éléments propres au site fonctionnent.
Upgrading a workstation|Mise à jour dune station de travail
Do all the basic things like on the main server and without doing the things not needed. If not yet done, configure the machine to use Kerberos for mounting home directories, see the getting started chapter for details.|Effectuez toutes les tâches de base comme sur le serveur principal, mais sans faire les actions inutiles. Si ce nest pas déjà fait, configurez la machine pour quelle utilise Kerberos pour monter les répertoires personnels, voir le chapitre Démarrage rapide pour les détails.
Upgrades from older Debian Edu Skolelinux installations (before Buster)|Mises à jour depuis des installations antérieures de Debian Edu/Skolelinux (avant Buster)
To upgrade from any older release, you will need to upgrade to the Buster based Debian Edu release first, before you can follow the instructions provided above. Instructions are given in the Manual for Debian Edu Buster about how to upgrade to Buster from the previous release, Stretch. Likewise the Stretch manual describes how to upgrade from Jessie.|Pour mettre à niveau à partir de toute autre version plus ancienne, vous devez dabord mettre à niveau vers la version Buster de Debian Edu avant de pouvoir suivre les instructions fournies ci dessus. La façon de migrer est décrite dans le Manuel pour Debian Edu Buster qui contient les instructions pour mettre à niveau vers Buster à partir de la version précédente, Stretch. De même, le manuel de Stretch couvre la mise à niveau depuis Jessie.
HowTo|Manuels (HowTo)
HowTos for general administration|Manuels dadministration générale
HowTos for advanced administration|Manuels dadministration avancée
HowTos for the desktop|Manuels pour le bureau
HowTos for networked clients|Manuels sur les clients en réseau
HowTos for Samba|Manuels pour Samba
HowTos for teaching and learning|Manuels pour enseigner et apprendre
HowTos for users|Manuels pour les utilisateurs
HowTos for general administration|Manuels dadministration générale
The Getting Started and Maintenance chapters describe how to get started with Debian Edu and how to do the basic maintenance work. The howtos in this chapter have some more advanced tips and tricks.|Les chapitres Démarrage rapide et Maintenance décrivent comment prendre en main Debian Edu et comment effectuer le travail de maintenance de base. Les manuels de ce chapitre décrivent des astuces avancées
Configuration history: tracking /etc/ using the git version control system|Historique de configuration suivre les changements de /etc/ en utilisant le système de gestion de versions Git
Using etckeeper, all files in /etc/ are tracked using Git as a version control system.|Avec lutilisation de etckeeper, tous les fichiers situés dans /etc/ sont suivis en utilisant le système de gestion de versions Git.
This makes it possible to see when a file is added, changed and removed, as well as what was changed if the file is a text file. The git repository is stored in /etc/.git/.|Cela permet de voir quand un fichier est ajouté, modifié ou supprimé, ainsi que de voir ce qui a changé dans le fichier si celui ci est un fichier texte. Le dépôt Git est stocké dans /etc/.git/.
Every hour, any changes are automatically recorded, allowing configuration history to be extracted and reviewed.|Toutes les heures, les changements sont automatiquement enregistrés, ce qui permet lextraction et la consultation de lhistorique de configuration.
To look at the history, the command etckeeper vcs log is used. To check the differences between two points in time, a command like etckeeper vcs diff can be used.|Pour consulter lhistorique, utilisez la commande etckeeper vcs log. Pour vérifier les différences entre deux moments dans le temps, vous pouvez utiliser une commande du genre etckeeper vcs diff.
See the output of man etckeeper for more information.|Veuillez consulter la sortie de man etckeeper pour des informations plus détaillées.
List of useful commands:|Liste de commandes utiles
Usage examples|Exemples dutilisation
On a freshly installed system, try this to see all changes done since the system was installed:|Sur un système récemment installé, lancez cette commande pour voir tous les changements effectués depuis linstallation
See which files are currently not tracked and which are not up to date:|Pour voir les fichiers qui actuellement ne sont pas suivis ou qui ne sont pas à jour
To manually commit a file, because you dont want to wait up to an hour:|Pour soumettre vous même un fichier, parce que vous ne souhaitez pas attendre jusquà une heure
Resizing Partitions|Redimensionner les partitions
In Debian Edu, all partitions other than the /boot/ partition are on logical LVM volumes. With Linux kernels since version 2.6.10, it is possible to extend partitions while they are mounted. Shrinking partitions still needs to happen while the partition is unmounted.|Dans Debian Edu, toutes les partitions autres que /boot/ sont sur des volumes logiques LVM. Depuis la version 2.6.10 du noyau Linux, il est possible détendre des partitions alors quelles sont montées. La réduction dune partition doit toujours être effectuée lorsque celle ci est démontée.
It is a good idea to avoid creating very large partitions (over, say, 20GiB), because of the time it takes to run fsck on them or to restore them from backup if the need arises. It is better, if possible, to create several smaller partitions than one very large one.|Il est judicieux déviter de créer de très grandes partitions (par exemple au delà de 20 Gio), à cause du temps que prend lexécution de fsck sur celles ci ou la restauration depuis une sauvegarde, si cela savérait nécessaire. Il est préférable, si possible, de créer plusieurs petites partitions plutôt quune seule très grande.
The helper script debian edu fsautoresize is provided to make it easier to extend full partitions. When invoked, it reads the configuration from /usr/share/debian edu config/fsautoresizetab, /site/etc/fsautoresizetab and /etc/fsautoresizetab. It then proposes to extend partitions with too little free space, according to the rules provided in these files. If run with no arguments, it will only show the commands needed to extend the file system. The argument n is needed to actually execute these commands to extend the file systems.|Le scriptdebian edu fsautoresize est fourni afin de faciliter lextension de partitions pleines. Celui ci lit la configuration depuis /usr/share/debian edu config/fsautoresizetab, /site/etc/fsautoresizetab et /etc/fsautoresizetab. À partir des règles décrites dans ces fichiers, il propose détendre les partitions ne disposant que de peu de place libre. Sil est appelé sans argument, il affiche seulement les commandes permettant détendre le système de fichiers. Le paramètre n est requis pour effectuer réellement lopération.
The script is executed automatically every hour on every client listed in the fsautoresize hosts netgroup.|Le script est exécuté automatiquement toutes les heures sur chaque client du groupe réseau fsautoresize hosts.
When the partition used by the Squid proxy is resized, the value for cache size in etc/squid/squid.conf needs to be updated as well. The helper script /usr/share/debian edu config/tools/squid update cachedir is provided to do this automatically, checking the current partition size of /var/spool/squid/ and configuring Squid to use 80|Quand vous redimensionnez la partition utilisée par le mandataire Squid, la taille du cache dans le fichier etc/squid/squid.conf doit également être modifiée. Le script /usr/share/debian edu config/tools/squid update cachedir effectue cela pour vous automatiquement, en vérifiant la taille actuelle de la partition de /var/spool/squid/ et en configurant Squid pour utiliser 80
Logical Volume Management|Gestion dun volume logique
Logical Volume Management (LVM) enables resizing the partitions while they are mounted and in use. You can learn more about LVM from the LVM HowTo.|La Gestion des Volumes Logiques (LVM) permet de redimensionner les partitions lorsquelles sont montées et en cours dutilisation. Vous pouvez en apprendre davantage sur LVM en consultant le Manuel LVM.
To extend a logical volume manually you simply tell the lvextend command how large you want it to grow to. For example, to extend home0 to 30GiB you use the following commands:|Pour étendre un volume logique vous même, indiquez simplement la taille que vous souhaitez atteindre à la commande lvextend. Par exemple, pour étendre home0 jusquà 30 Gio, utilisez les commandes suivantes
To extend home0 by additional 30GiB, you insert a ( L+30G)|Pour ajouter 30 Gio à home0, insérez un ( L+30G)
Using ldapvi|Utilisation de ldapvi
ldapvi is a tool to edit the LDAP database with a normal text editor on the commandline.|ldapvi est un outil pour éditer la base de données LDAP à laide dun éditeur de texte en ligne de commande.
The following needs to be executed:|Vous devez exécuter ceci
Note: ldapvi will use whatever is the default editor. By executing export EDITOR=vim in the shell prompt one can configure the environment to get a vi clone as editor.|Note ldapvi utilisera léditeur par défaut, quel quil soit. En exécutant export EDITOR=vim sur la ligne de commande, vous pouvez configurer lenvironnement pour utiliser un clone de vi comme éditeur.
To add an LDAP object using ldapvi, use object sequence number with the string add in front of the new LDAP object.|Pour ajouter un objet LDAP avec ldapvi, utilisez le numéro de séquence de lobjet en faisant précéder le nouvel objet LDAP de la chaîne add.
Warning: ldapvi is a very powerful tool. Be careful and dont mess up the LDAP database, same warning applies for JXplorer.|Attention ldapvi est un outil très puissant. Utilisez le avec précaution pour ne pas endommager la base de données LDAP. Le même avertissement sapplique à JXplorer.
Kerberized NFS|NFS avec Kerberos
Using Kerberos for NFS to mount home directories is a security feature. As of Bullseye, LTSP clients wont work without Kerberos. The levels krb5, krb5i and krb5p are supported (krb5 means Kerberos authentication, i stands for integrity check and p for privacy, i.e. encryption); the load on both server and workstation increases with the security level, krb5i is a good choice and has been chosen as default.|Lutilisation de Kerberos pour NFS afin de monter des répertoires home est une fonctionnalité de sécurité. Depuis Bullseye, les clients LTSP ne fonctionnent plus sans Kerberos. Les niveaux krb5, krb5i et krb5p sont pris en charge (krb5 signifie authentification Kerberos, i représente une vérification dintégrité et p,la protection des données personnelles, cest à dire le chiffrement) en fonction du niveau de sécurité, la charge augmente à la fois sur le serveur et sur les stations de travail, krb5i est un bon choix et a été choisi comme niveau de sécurité par défaut.
How to change the default|Comment modifier le niveau de sécurité par défaut
Main server|Serveur principal
login as root|connectez vous en tant que superutilisateur
run ldapvi ZD (cn=admin), search for sec=krb5i and replace it with sec=krb5 or sec=krb5p.|exécutez ldapvi ZD (cn=admin), recherchez sec=krb5i et remplacez le par sec=krb5 ou sec=krb5p.
edit /etc/exports.d/edu.exports and adjust these entries accordingly:|éditez le fichier /etc/exports.d/edu.exports et ajustez ces entrées en conséquence
run exportfs r|exécutez exportfs r
This tool allows to set the default printer depending on location, machine, or group membership. For more information, see /usr/share/doc/standardskriver/README.md.|Cet outil permet de définir limprimante par défaut en fonction de lemplacement, de la machine ou de lappartenance à un groupe. Pour plus dinformations, lire /usr/share/doc/standardskriver/README.md.
The configuration file /etc/standardskriver.cfg has to be provided by the admin, see /usr/share/doc/standardskriver/examples/standardskriver.cfg as an example.|Le fichier de configuration /etc/standardskriver.cfg doit être fourni par ladministrateur, voir /usr/share/doc/standardskriver/examples/standardskriver.cfgcomme exemple.
JXplorer, an LDAP GUI|JXplorer, une interface graphique à LDAP
If you prefer a GUI to work with the LDAP database, check out the jxplorer package, which is installed by default. To get write access connect like this:|Si vous préférez une interface graphique pour manipuler la base de données LDAP, regardez du côté du paquet jxplorer, qui est installé par défaut. Pour obtenir laccès en écriture, connectez vous comme ceci
host: ldap.intern port: 636 Security level: ssl user password User dn: cn=admin,ou=ldap access,dc=skole,dc=skolelinux,dc=no|host: ldap.intern port:636 Security level: ssl user password User dn: cn=admin,ou=ldap access,dc=skole,dc=skolelinux,dc=no
ldap createuser krb, a command line tool|ldap createuser krb, un outil en ligne de commande
ldap createuser krb is a small command line tool to create LDAP users and set their passwords in Kerberos. Its mostly useful for testing, though.|ldap createuser krb est un petit utilitaire en ligne de commande pour créer des utilisateurs LDAP et définir leurs mots de passe dans Kerberos. Il est surtout utile pour des tests.
Using stable updates|Utilisation de stable updates
Since the Squeeze release in 2011, Debian has included packages formerly maintained in volatile.debian.org in the stable updates suite.|Depuis la publication de Squeeze en 2011, Debian fournit dans la suite stable updates des paquets qui étaient auparavant maintenus sur volatile.debian.org.
While you can use stable updates directly, you dont have to: stable updates are pushed into the stable suite regularly when stable point releases are done, which roughly happens every two months.|Bien que vous puissiez utiliser les dépôts stable updates directement, vous ny êtes pas obligé les mises à jour de stable updates sont régulièrement poussées vers la distribution stable lors des mises à jour intermédiaires, ce qui arrive environ tous les deux mois.
Using backports to install newer software|Utilisation des rétroportages pour installer des logiciels plus récents
You are running Debian Edu because you prefer the stability of Debian Edu. It runs great; there is just one problem: sometimes software is a little bit more outdated than you like. This is where backports.debian.org steps in.|Vous utilisez Debian Edu parce que vous appréciez sa stabilité. Elle fonctionne très bien, il y a juste un problème parfois, les logiciels sont un peu plus anciens que vous ne le souhaiteriez. Cest là quintervient backports.debian.org.
Backports are recompiled packages from Debian testing (mostly) and Debian unstable (in a few cases only, e.g. security updates), so they will run without new libraries (wherever this is possible) on a stable Debian distribution like Debian Edu. We recommend you to pick out individual backports which fit your needs, and not to use all backports available there.|Les paquets rétroportés backports sont recompilés depuis la version de test (principalement) et la version instable de Debian (dans certains cas seulement, par exemple dans le cas de mises à jour de sécurité), de sorte quils pourront sexécuter sans nouvelles bibliothèques (autant que possible) sur une distribution stable de Debian telle que Debian Edu. Nous vous recommandons de ninstaller que les paquets rétroportés qui correspondent vraiment à vos besoins, et de ne pas utiliser tous ceux qui sont disponibles.
Using backports is simple:|Lutilisation des paquets rétroportés est simple
After which one can install backported packages easily, the following command will install a backported version of tuxtype:|Après cette étape, il est possible dinstaller facilement des paquets rétroportés. La commande suivante installera la version rétroportée de tuxtype
Backports are automatically updated (if available) just like other packages. Like the normal archive, backports has three sections: main, contrib and non free.|Les rétroportages sont mis à jour automatiquement (sils sont disponibles) comme les autres paquets. Tout comme larchive principale, larchive des paquets rétroportés comporte trois sections main, contrib et non free.
Upgrading with a CD or similar image|Mettre à jour avec un CD ou une image similaire
If you want to upgrade from one version to another (for example from Bullseye 11.1 to 11.2) but you do not have Internet connectivity, only physical media, follow these steps:|Si vous voulez mettre à niveau dune version à une autre (par exemple de Bullseye 11.1 à 11.2), mais que vous ne possédez pas de connexion Internet, mais seulement un support physique, suivez ces étapes
Insert the CD DVD Blu ray disc USB flash drive and use the apt cdrom command:|Insérez le CD, DVD, disque Blu ray ou périphérique USB et utilisez la commande apt cdrom
To quote the apt cdrom(8) man page:|Daprès la page de manuel dapt cdrom(8)
apt cdrom is used to add a new CD ROM to APTs list of available sources. apt cdrom takes care of determining the structure of the disc as well as correcting for several possible mis burns and verifying the index files.|apt cdrom est utilisé pour ajouter un nouveau CD à la liste de sources APT disponibles. apt cdrom soccupe de déterminer la structure du disque ainsi que de corriger plusieurs problèmes de gravure possibles et de vérifier les fichiers dindex.
It is necessary to use apt cdrom to add CDs to the APT system, it cannot be done by hand. Furthermore each disk in a multi CD set must be inserted and scanned separately to account for possible mis burns.|Vous devez utiliser apt cdrom pour ajouter des CD au système APT, vous ne pouvez pas le faire vous même. De plus, chaque disque faisant partie dun ensemble de plusieurs disques doit être inséré et balayé par le logiciel indépendamment pour prévenir certains problèmes de gravure.
Then run these two commands to upgrade the system:|Exécutez ensuite ces deux commandes pour mettre à niveau le système
Automatic cleanup of leftover processes|Nettoyage automatique des processus résiduels
killer is a perl script that gets rid of background jobs. Background jobs are defined as processes that belong to users who are not currently logged into the machine. Its run by cron job once an hour.|killer est un script Perl qui se débarrasse des processus darrière plan. Ce sont des processus qui appartiennent à des utilisateurs qui ne sont plus connectés à la machine. Il est exécuté par loutil cron toutes les heures.
Automatic installation of security upgrades|Installation automatique des mises à niveau de sécurité
unattended upgrades is a Debian package which will install security (and other) upgrades automatically. If installed, the package is preconfigured to install security upgrades. The logs are available in /var/log/unattended upgrades/; also, there are always /var/log/dpkg.log and /var/log/apt/.|unattended upgrades est un paquet Debian qui installera (entre autres) les mises à niveau de sécurité automatiquement. Sil est installé, le paquet est préconfiguré pour installer les mises à niveau de sécurité. Les journaux de mises à niveau sont disponibles dans /var/log/unattended upgrades/ il y a toujours aussi /var/log/dpkg.log et /var/log/apt/.
Automatic shutdown of machines during the night|Arrêt automatique des machines la nuit
It is possible to save energy and money by automatically turning client machines off at night and back on in the morning. The package shutdown at night will try to turn off the machine every hour on the hour from 16:00 in the afternoon, but will not turn it off if it seems to have users. It will try to tell the BIOS to turn on the machine around 07:00 in the morning, and the main server will try to turn on machines from 06:30 by sending wake on lan packets. These times can be changed in the crontabs of individual machines.|Il est possible déconomiser de lénergie et de largent en éteignant les clients la nuit, et en les rallumant automatiquement le matin. Le paquet shutdown at night tentera déteindre la machine toutes les heures à partir de 16 h 00, sauf si des utilisateurs sont connectés. Il essayera également dindiquer au BIOS dallumer les machines vers 7 h 00 du matin, et le serveur principal tentera dallumer les machines à partir de 6 h 30 en utilisant les paquets wake on lan. Les heures peuvent être modifiées dans les crontabs de chaque machine.
Some considerations should be kept in mind when setting this up:|Il y a quelques considérations à prendre en compte en faisant cela
