en|fr
The package p910nd is installed by default on a system with the Workstation profile.|Le paquet p910nd est installé par défaut dans un système avec le profil Station de travail.
Edit /etc/default/p910nd like this (USB printer):|Éditez ainsi /etc/default/p910nd (imprimante USB)
Configure the printer using the web interface choose network printer type AppSocket/HP JetDirect (for all printers regardless of brand or model) and set socket://<workstation ip>:9100 as connection URI.|Configurez limprimante en utilisant linterface web Choisissez le type dimprimante réseau AppSocket/HP JetDirect (pour toutes les imprimantes, quels que soient la marque et le modèle) et entrez socket://<ip station de travail>:9100 comme URI de connexion.
Network printers|Imprimantes en réseau
It is recommended to disable all self advertising features in the used network printers. Instead, assign a fixed IP address with GOsa² and configure them as AppSocket/HP JetDirect network printers.|Il est recommandé de désactiver toutes les fonctionnalités d’auto promotion dans les imprimantes réseau utilisées. Assignez leur plutôt une adresse IP fixe avec GOsa² et configurez les comme imprimantes réseau AppSocket/HP JetDirect.
Clock synchronisation|Synchronisation de lhorloge
The default configuration in Debian Edu is to keep the clocks on all machines synchronous but not necessarily correct. NTP is used to update the time. The clocks will be synchronised with an external source by default. This can cause machines to keep the external Internet connection open if it is created when used.|La configuration par défaut dans Debian Edu garde les horloges de toutes les machines synchronisées, mais pas nécessairement à lheure exacte. NTP est utilisé pour mettre à jour lheure. Par défaut, les horloges seront synchronisées avec une source externe. Par conséquent, les machines pourraient conserver la connexion ouverte si elles sont configurées avec Internet.
If you use dialup or ISDN and pay per minute, you want to change this default setting.|Si vous utilisez un modem téléphonique ou ISDN et payez à la minute, vous voudrez changer ce paramètre par défaut.
To disable synchronisation with an external clock, the file /etc/ntp.conf on the main server needs to be modified. Add comment marks in front of the server entries. After this, the NTP server needs to be restarted by running service ntp restart as root. To test if a machine is using the external clock sources, run ntpq c lpeer.|Pour désactiver la synchronisation avec une horloge externe, le fichier /etc/ntp.conf sur le serveur principal doit être modifié. Ajoutez des symboles de commentaire devant les entrées serveur. Après cela, le serveur NTP doit être redémarré en exécutant service ntp restart en tant que superutilisateur. Pour tester si le serveur utilise les sources dhorloges externes, exécutez ntpq c lpeer.
Extending full partitions|Étendre les partitions pleines
Because of a possible bug with automatic partitioning, some partitions might be too full after installation. To extend these partitions, run debian edu fsautoresize n as root. See the Resizing Partitions HowTo in the administration HowTo chapter for more information.|À cause dun bogue dans le partitionnement automatique, certaines partitions peuvent être trop remplies après linstallation. Pour étendre ces partitions, exécutez debian edu fsautoresize n en tant que superutilisateur. Consultez le manuel Redimensionnement de partition dans le chapitre dadministration générale pour plus dinformations.
Updating the software|Mise à jour des logiciels
This section explains how to use apt full upgrade.|Cette section explique comment utiliser apt full upgrade.
Using apt is really simply. To update a system you need to execute two commands on the command line as root: apt update (which updates the lists of available packages) and apt full upgrade (which upgrades the packages for which an upgrade is available).|Utiliser apt est vraiment simple. Pour mettre à niveau un système, vous devez exécuter deux commandes en tant que superutilisateur apt update (mise à jour des listes de paquets disponibles) et apt full upgrade (mise à niveau des paquets pour lesquels une mise à niveau est disponible).
It is also a good idea to upgrade using the C locale to get English output which in cases of problems is more likely to produce results in search engines.|Cest aussi une bonne idée dutiliser les paramètres régionaux C locale pour la mise à niveau, afin dobtenir des messages en anglais ce qui, en cas de problème, a plus de chance dobtenir des résultats dans les moteurs de recherche.
After upgrading the debian edu config package, changed Cfengine configuration files might be available. Run ls ltr /etc/cfengine3/debian edu/ to check if this is the case. To apply the changes, run LC_ALL=C cf agent D installation.|Après la mise à niveau du paquet debian edu config, des fichiers de configuration modifiés de Cfengine pourraient être disponibles. Exécutez la commande ls ltr /etc/cfengine3/debian edu/ pour vérifier si cest le cas. Pour appliquer les modifications, exécutez la commande LC_ALL=C cf agent D installation.
It is important to run debian edu ltsp install diskless_workstation yes after LTSP server upgrades to keep the SquashFS image for diskless clients in sync.|Il est important d’exécuter debian edu ltsp install diskless_workstation yes après les mises à niveau de serveur LTSP pour conserver l’image SquashFS pour la liste des clients sans disque synchronisée.
After a point release upgrade of a system with Main Server or LTSP Server profile, debian edu pxeinstall needs to be run to update the PXE installation environment.|Après une mise à niveau intermédiaire dun système avec un profil Serveur principal ou Serveur LTSP, debian edu pxeinstall a besoin dêtre exécuté pour mettre à jour lenvironnement dinstallation PXE.
It is also a good idea to install cron apt and apt listchanges and configure them to send mail to an address you are reading.|Par ailleurs, il est judicieux dinstaller cron apt et apt listchanges et de les configurer pour envoyer des courriers électronique à une adresse que vous consulterez.
cron apt will notify you once a day via email about any packages that can be upgraded. It does not install these upgrades, but does download them (usually in the night), so you dont have to wait for the download when you do apt full upgrade.|cron apt vous signalera une fois par jour par courrier électronique quels paquets peuvent être mis à niveau. Ce mécanisme ninstalle pas les mises à niveau, mais les télécharge (généralement la nuit), de sorte que vous naurez pas besoin dattendre la fin du téléchargement quand vous lancerez apt full upgrade.
Automatic installation of updates can be done easily if desired, it just needs the unattended upgrades package to be installed and configured as described on wiki.debian.org/UnattendedUpgrades.|Si vous le souhaitez, linstallation des mises à jour peut être rendue automatique, simplement en installant et en configurant le paquet unattended upgrades comme décrit sur la page wiki.debian.org/UnattendedUpgrades.
apt listchanges can send new changelog entries to you via email, or alternatively display them in the terminal when running apt.|apt listchanges peut vous envoyer par courrier électronique les nouvelles entrées des journaux de modifications, ou bien les afficher dans un terminal lorsque la commande apt est utilisée.
Keep yourself informed about security updates|Restez informé des mises à jour de sécurité
Running cron apt as described above is a good way to learn when security updates are available for installed packages. Another way to stay informed about security updates is to subscribe to the Debian security announce mailinglist, which has the benefit of also telling you what the security update is about. The downside (compared to cron apt) is that it also includes information about updates for packages which arent installed.|Exécuter cron apt tel que décrit plus haut est une bonne façon de savoir lorsque des mises à jour de sécurité sont disponibles pour les paquets installés. Une autre façon de se tenir informé sur les mises à jour de sécurité est de sinscrire à la liste de diffusion Debian security announce qui indique également quel est lobjet de cette mise à jour de sécurité. Linconvénient (par rapport à cron apt) est quelle diffuse également des informations sur des mises à jour de paquets qui ne sont pas installés.
Backup Management|Gestion des sauvegardes
For backup management point your browser to Please note that you need to access this site via SSL, since you have to enter the root password there. If you try to access this site without using SSL it will fail.|Pour la gestion des sauvegardes, faites pointer votre navigateur sur Veuillez noter que vous devez accéder à ce site par SSL, puisque le mot de passe du superutilisateur devra être saisi. En labsence de chiffrement par SSL, la tentative daccès échouera.
Note: the site will only work if you temporarily allow SSH root login on the backup server, which is the main server (tjener.intern) by default.|Remarque le site ne fonctionnera que si vous permettez temporairement la connexion du superutilisateur par SSH sur le serveur de sauvegarde qui est le serveur principal par défaut (tjener.intern).
By default, backups of /skole/tjener/home0, /etc/, /root/.svk and LDAP are stored in the /skole/backup/ directory which is managed as separate partition by LVM. If you only want to have spare copies of things (in case you delete them) this setup should be fine for you.|Par défaut, les sauvegardes de /skole/tjener/home0, /etc/, /root/.svk et LDAP sont stockées dans le répertoire /skole/backup/, qui est géré comme une partition séparée de LVM. Si vous souhaitez seulement avoir des copies (en cas deffacement), cette configuration devrait suffire.
Be aware that this backup scheme doesnt protect you from failing hard drives.|Soyez conscient que cette sauvegarde ne protège pas dune panne de disque dur.
If you want to back up your data to an external server, a tape device or another hard drive youll have to modify the existing configuration a bit.|Si vous souhaitez sauvegarder vos données sur un serveur externe, un lecteur de bande magnétique ou un autre disque dur, vous devrez légèrement modifier la configuration actuelle.
If you want to restore a complete folder, your best option is to use the command line:|Si vous voulez restaurer un répertoire complet, votre meilleure option est dutiliser la ligne de commande
This will leave the content from /skole/tjener/home0/user for <date> in the folder /skole/tjener/home0/user_<date>|Cela mettra le contenu de /skole/tjener/home0/user du <date> dans le répertoire /skole/tjener/home0/user_<date>
If you want to restore a single file, then you should be able to select the file (and the version) from the web interface, and download only that file.|Si vous voulez restaurer un seul fichier, vous devriez pouvoir le sélectionner (ainsi que la version) à partir de linterface web, et ne télécharger que ce fichier.
If you want to get rid of older backups, choose Maintenance in the menu on the backup page and select the oldest snapshot to keep:|Si vous souhaitez vous débarrasser des anciennes sauvegardes, choisissez Maintenance dans le menu de la page des sauvegarde et choisissez le dernier instantané à garder
slbackup php Maintenance|Maintenance de slbackup php
Server Monitoring|Surveillance des serveurs
The Munin trend reporting system is available from It provides system status measurement graphs on a daily, weekly, monthly and yearly basis, and provides the system administrator with help when looking for bottlenecks and the source of system problems.|Le système de rapport Munin est disponible depuis Il présente graphiquement des mesures de létat du système de manière quotidienne, hebdomadaire, mensuelle et annuelle, et il apporte de laide à ladministrateur système pour identifier des goulots détranglement et la cause de problèmes du système.
The list of machines being monitored using Munin is generated automatically, based on the list of hosts reporting to sitesummary. All hosts with the package munin node installed are registered for Munin monitoring. It will normally take one day from a machine being installed until Munin monitoring starts, because of the order the cron jobs are executed. To speed up the process, run sitesummary update munin as root on the sitesummary server (normally the main server). This will update the /etc/munin/munin.conf file.|La liste des machines surveillées à laide de Munin est créée automatiquement à partir de la liste des hôtes faisant des rapports à sitesummary. Tous les hôtes sur lesquels le paquet munin node est installé sont enregistrés pour être surveillés par Munin. Normalement, la surveillance par Munin commencera un jour après linstallation dune machine, en raison de lordre dexécution des tâches planifiées par cron. Afin daccélérer le processus, lancez sitesummary update munin en tant que superutilisateur sur le serveur sitesummary (normalement, le serveur principal). Cette commande mettra à jour le fichier /etc/munin/munin.conf.
The set of measurements being collected is automatically generated on each machine using the munin node configure program which probes the plugins available from /usr/share/munin/plugins/ and symlinks the relevant ones to /etc/munin/plugins/.|Lensemble des mesures collectées est créé automatiquement sur chaque machine grâce au programme munin node configure qui sonde les greffons disponibles dans /usr/share/munin/plugins/ et crée des liens symboliques dans /etc/munin/plugins/ pour les greffons pertinents.
Information about Munin is available from|Des informations sur le système Munin sont disponibles depuis
Icinga system and service monitoring is available from The set of machines and services being monitored is automatically generated using information collected by the sitesummary system. The machines with the profile Main server and LTSP server receive full monitoring, while workstations and thin clients receive simple monitoring. To enable full monitoring on a workstation, install the nagios nrpe server package on the workstation.|Icinga, loutil de surveillance du système et des services, est disponible depuis le site La liste des machines et services surveillés est automatiquement générée en utilisant linformation collectée par le système sitesummary. Les machines ayant le profil Serveur principal et Serveur LTSP ont une surveillance plus complète que les stations de travail et les clients légers. Pour activer une surveillance complète pour une station de travail, installez y le paquet nagios nrpe server.
By default Icinga does not send email. This can be changed by replacing notify by nothing with host notify by email and notify by email in the file /etc/icinga/sitesummary template contacts.cfg.|Par défaut, Icinga nenvoie pas de courrier électronique. Ce comportement peut être modifié en remplaçant notify by nothing par host notify by email et notify by email dans le fichier /etc/icinga/sitesummary template contacts.cfg.
The Icinga configuration file used is /etc/icinga/sitesummary.cfg. The sitesummary cron job generates /var/lib/sitesummary/icinga generated.cfg with the list of hosts and services to monitor.|Le fichier de configuration utilisé par Icinga est /etc/icinga/sitesummary.cfg. La tâche cron sitesummary génère un fichier /var/lib/sitesummary/icinga generated.cfg contenant la liste des hôtes et services à surveiller.
Extra Icinga checks can be put in the file /var/lib/sitesummary/icinga generated.cfg.post to get them included in the generated file.|Des validations supplémentaires pour Icinga peuvent être ajoutées au fichier /var/lib/sitesummary/icinga generated.cfg.post afin de les inclure dans le fichier généré.
Information about Icinga is available from or in the icinga doc package.|Davantage dinformations sur le système Icinga sont disponibles sur ou dans le paquet icinga doc.
Common Icinga warnings and how to handle them|Avertissements courants dIcinga et comment les gérer
Here are instructions on how to handle the most common Icinga warnings.|Voici les instructions à suivre pour gérer les avertissements les plus courants de Icinga.
The partition (/usr/ in the example) is too full. There are in general two ways to handle this: (1) remove some files or (2) increase the size of the partition. If the partition is /var/, purging the APT cache by calling apt clean might remove some files. If there is more room available in the LVM volume group, running the program debian edu fsautoresize to extend the partitions might help. To run this program automatically every hour, the host in question can be added to the fsautoresize hosts netgroup.|La partition (/usr/ dans lexemple) est pleine. Il existe en général deux façons de gérer cela. La première consiste à supprimer quelques fichiers et la seconde à augmenter la taille de la partition. Si la partition concernée est /var/, purger le cache dAPT en appelant apt clean devrait supprimer quelques fichiers. Sil reste de la place disponible sur le groupe de volume LVM, exécuter le programme debian edu fsautoresize pour agrandir la partition devrait aider. Pour lancer ce programme automatiquement toutes les heures, lhôte concerné peut être ajouté au groupe réseau fsautoresize hosts.
New package are available for upgrades. The critical ones are normally security fixes. To upgrade, run apt upgrade apt full upgrade as root in a terminal or log in via SSH to do the same.|De nouveaux paquets sont disponibles pour la mise à niveau. Les paquets critiques sont normalement des corrections de sécurité. Pour mettre à niveau, lancez apt upgrade apt full upgrade en tant que superutilisateur dans un terminal ou en vous connectant par SSH.
If you do not want to manually upgrade packages and trust Debian to do a good job with new versions, you can configure unattended upgrades to automatically upgrade all new packages every night. This will not upgrade the LTSP chroots.|Si vous ne voulez pas mettre les paquets à niveau vous même et que vous faites confiance à Debian pour faire du bon travail avec les nouvelles versions, vous pouvez configurer unattended upgrades pour mettre à niveau automatiquement tous les nouveaux paquets chaque nuit. Cela ne mettra pas à jour les chroots LTSP.
The running kernel is older than the newest installed kernel, and a reboot is required to activate the newest installed kernel. This is normally fairly urgent, as new kernels normally show up in Debian Edu to fix security issues.|Le noyau en cours dutilisation est plus ancien que le noyau installé le plus récent et un redémarrage est nécessaire pour activer ce nouveau noyau. Cest normalement plutôt urgent puisque les nouveaux noyaux apparaissent dans Debian Edu pour corriger des problèmes de sécurité.
The printer queues in CUPS have a lot of jobs pending. This is most likely because of a unavailable printer. Disabled print queues are enabled every hour on hosts that are member of the cups queue autoreenable hosts netgroup, so for such hosts no manual action should be required. The print queues are emptied every night on hosts that are member of the cups queue autoflush hosts netgroup. If a host have a lot of jobs in their queue, consider adding this host to one or both of these netgroups.|Les files dattente dimpression de CUPS ont beaucoup de tâches en attente. Cest très probablement dû à une imprimante indisponible. Les files dattente dimpression désactivées sont activées toutes les heures sur les hôtes du groupe réseau cups queue autoreenable hosts, donc aucune action manuelle nest nécessaire pour ces hôtes. Les files dattente dimpression sont vidées toutes les nuits pour les hôtes du groupe réseau cups queue autoflush hosts. Si un hôte a beaucoup de tâche en attente dans sa file, vous devriez lajouter à au moins un de ces deux groupes réseau.
Sitesummary is used to collect information from each computer and submit it to the central server. The information collected is available in /var/lib/sitesummary/entries/. Scripts in /usr/lib/sitesummary/ are available to generate reports.|Sitesummary est utilisé pour collecter de linformation depuis chaque ordinateur et lenvoyer au serveur central. Linformation collectée est disponible dans /var/lib/sitesummary/entries/. Les scripts dans /usr/lib/sitesummary/ permettent de générer des rapports.
A simple report from Sitesummary without any details is available from|Un rapport simple provenant de Sitesummary sans détail est disponible sur
Some documentation on Sitesummary is available from|Des informations sur Sitesummary sont disponibles sur
More information about Debian Edu customisations|Informations supplémentaires à propos des modifications particulières à Debian Edu
More information about Debian Edu customisations useful for system administrators can be found in the Administration Howto chapter and in the Advanced administration Howto chapter|Des informations supplémentaires sur les personnalisations de Debian Edu, utiles aux administrateurs système, sont disponibles dans les chapitres dadministration générale et dadministration avancée
Upgrades|Mises à jour
Before reading this upgrade guide, please note that live updates to your production servers are carried out at your own risk. Debian Edu/Skolelinux comes with ABSOLUTELY NO WARRANTY, to the extent permitted by applicable law.|Avant dexpliquer le processus de mise à niveau, nous attirons votre attention sur le fait que son exécution sur un serveur en production se fera à vos risques et périls. Debian Edu/Skolelinux est disponible sans ABSOLUMENT AUCUNE GARANTIE, tel que permis par les lois en vigueur..
Please read this chapter and the New features in Bookworm chapter of this manual completely before attempting to upgrade.|Veuillez lire en entier ce chapitre et le chapitre Nouvelles fonctionnalités dans Debian Edu Bookworm avant de débuter la mise à niveau de vos systèmes.
General notes on upgrading|Notes à propos de la mise à niveau
Upgrading Debian from one distribution to the next is generally rather easy. For Debian Edu this is unfortunately a bit more complicated as we modify configuration files in ways we shouldnt. However we have documented the needed steps below. (See Debian bug 311188 for more information how Debian Edu should modify configuration files.)|Mettre à jour Debian dune distribution à la suivante est généralement assez facile. Cest malheureusement un peu plus compliqué pour Debian Edu, car nous modifions les fichiers de configuration dune façon que nous ne devrions pas. Néanmoins, nous avons documenté les étapes nécessaires ci dessous. (Consultez le bogue Debian nº 311188 pour plus dinformations en anglais sur la manière dont Debian Edu doit modifier les fichiers de configuration.)
In general, upgrading the servers is more difficult than the workstations and the main server is the most difficult to upgrade.|En général, la mise à niveau des serveurs est plus difficile que celle des stations de travail et celle du serveur principal est la plus difficile.
If you want to be sure that after the upgrade everything works as before, you should test the upgrade on a test system or systems configured the same way as your production machines. There you can test the upgrade without risk and see if everything works as it should.|Si vous voulez être certain que tout fonctionnera de la même manière après la mise à niveau, vous devriez appliquer celle ci sur un serveur de test ou de configuration identique à votre serveur de production. Vous pourrez ainsi vous assurer sans risque que tout fonctionne correctement.
Make sure to also read the information about the current Debian Stable release in its installation manual.|Assurez vous de lire également les informations à propos de la version stable actuelle de Debian dans son manuel dinstallation.
It may also be wise to wait a bit and keep running Oldstable for a few weeks longer, so that others can test the upgrade and document any problems they experience. The Oldstable release of Debian Edu will receive continued support for some time after the next Stable release, but when Debian ceases support for Oldstable, Debian Edu will necessarily do the same.|Par ailleurs, il peut être judicieux dattendre et de laisser tourner lancienne version stable pendant quelques semaines supplémentaires, de sorte que dautres puissent tester la mise à niveau et documenter les problèmes rencontrés. Lancienne version stable de Debian Edu recevra une prise en charge continue pendant encore quelques temps après la sortie de la nouvelle version stable, mais quand Debian cessera la prise en charge de lancienne stable, Debian Edu devra faire de même.
Upgrades from Debian Edu Bullseye|Mises à jour depuis Debian Edu Bullseye
Be prepared: make sure you have tested the upgrade from Bullseye in a test environment or have backups ready to be able to go back.|Soyez prêt assurez vous davoir testé la mise à niveau à partir de Bullseye dans un environnement de test ou bien davoir des sauvegardes prêtes à repartir.
Please note that the following recipe applies to a default Debian Edu main server installation (desktop=xfce, profiles Main Server, Workstation, LTSP Server). (For a general overview concerning Bullseye to Bookworm upgrade, see:|Veuillez noter que la recette suivante sapplique à une installation de serveur principal de Debian Edu (bureau Xfce, profils Serveur principal, Station de travail, Serveur LTSP). Pour un aperçu global de la mise à niveau de Bullseye à Bookworm, consultez
